{
  "schema_version": "2.0",
  "generated_at": "2026-10-19T04:08:56.159324+00:00",
  "expected_metrics": [
    "US10Y",
    "DXY",
    "VIX",
    "BTC",
    "ETH"
  ],
  "records": [
    {
      "metric_id": "US10Y",
      "name": "US 10-Year Treasury Yield",
      "category": "MACRO",
      "ticker": "DGS10",
      "value": 5.1,
      "previous_close": 5.19,
      "change_pct": -1.73,
      "unit": "%",
      "source": "FRED / Federal Reserve Board H.15",
      "source_type": "PRIMARY",
      "observed_at": "2026-10-15T00:00:00+00:00",
      "fetched_at": "2026-10-19T04:08:55.646030+00:00",
      "status": "FRESH",
      "error": null
    },
    {
      "metric_id": "DXY",
      "name": "US Dollar Index",
      "category": "FX",
      "ticker": "DX-Y.NYB",
      "value": 101.84,
      "previous_close": 102.0,
      "change_pct": -0.16,
      "unit": "INDEX",
      "source": "Yahoo Finance via yfinance",
      "source_type": "PRIMARY",
      "observed_at": "2026-10-16T04:00:00+00:00",
      "fetched_at": "2026-10-19T04:08:55.793938+00:00",
      "status": "FRESH",
      "error": null
    },
    {
      "metric_id": "VIX",
      "name": "CBOE Volatility Index",
      "category": "RISK",
      "ticker": "^VIX",
      "value": 19.99,
      "previous_close": 16.46,
      "change_pct": 21.45,
      "unit": "INDEX",
      "source": "Yahoo Finance via yfinance",
      "source_type": "PRIMARY",
      "observed_at": "2026-10-16T05:00:00+00:00",
      "fetched_at": "2026-10-19T04:08:55.836823+00:00",
      "status": "FRESH",
      "error": null
    },
    {
      "metric_id": "BTC",
      "name": "Bitcoin",
      "category": "CRYPTO",
      "ticker": "BTC-USD",
      "value": 82442.7701,
      "previous_close": 82019.5829,
      "change_pct": 0.52,
      "unit": "USD",
      "source": "CoinGecko Public API",
      "source_type": "PRIMARY",
      "observed_at": "2026-10-19T04:07:10+00:00",
      "fetched_at": "2026-10-19T04:08:56.003932+00:00",
      "status": "FRESH",
      "error": null
    },
    {
      "metric_id": "ETH",
      "name": "Ethereum",
      "category": "CRYPTO",
      "ticker": "ETH-USD",
      "value": 2420.8063,
      "previous_close": 2407.8424,
      "change_pct": 0.54,
      "unit": "USD",
      "source": "CoinGecko Public API",
      "source_type": "PRIMARY",
      "observed_at": "2026-10-19T04:07:30+00:00",
      "fetched_at": "2026-10-19T04:08:56.158572+00:00",
      "status": "FRESH",
      "error": null
    }
  ]
}